{
  "id": "jessica-watkins",
  "name": {
    "ja": "ジェシカ・ワトキンス",
    "en": "Jessica Watkins"
  },
  "agency": {
    "value": "NASA",
    "source": "https://www.nasa.gov/people/jessica-watkins/",
    "as_of": "2026-10-03"
  },
  "official_profile_url": "https://www.nasa.gov/people/jessica-watkins/",
  "teams": [
    "crew-13"
  ],
  "updated_at": "2026-10-03"
}
