{
  "id": "sergey-teteryatnikov",
  "name": {
    "ja": "セルゲイ・テテリャトニコフ",
    "en": "Sergey Teteryatnikov"
  },
  "agency": {
    "value": "Roscosmos",
    "source": "https://www.gctc.ru/main.php?id=6331",
    "as_of": "2026-10-03"
  },
  "official_profile_url": "https://www.gctc.ru/main.php?id=6331",
  "teams": [
    "crew-13"
  ],
  "updated_at": "2026-10-03"
}
