{
  "id": "luke-delaney",
  "name": {
    "ja": "ルーク・デラニー",
    "en": "Luke Delaney"
  },
  "agency": {
    "value": "NASA",
    "source": "https://www.nasa.gov/people/nasa-astronaut-luke-delaney/",
    "as_of": "2026-10-03"
  },
  "official_profile_url": "https://www.nasa.gov/people/nasa-astronaut-luke-delaney/",
  "teams": [
    "crew-13"
  ],
  "updated_at": "2026-10-03"
}
