{
  "id": "joshua-kutryk",
  "name": {
    "ja": "ジョシュア・クトリク",
    "en": "Joshua Kutryk"
  },
  "agency": {
    "value": "CSA",
    "source": "https://www.asc-csa.gc.ca/eng/astronauts/canadian/active/bio-joshua-kutryk.asp",
    "as_of": "2026-10-03"
  },
  "official_profile_url": "https://www.asc-csa.gc.ca/eng/astronauts/canadian/active/bio-joshua-kutryk.asp",
  "teams": [
    "crew-13"
  ],
  "updated_at": "2026-10-03"
}
